3, The table setting for Seoul Garden: the soup pot in the middle for boiling food, and a hotplate around it for frying.
1, soul cups cupcakes valentines display at say cheese in silver lake
7, Puppy's eating matzo ball soup @ Jerry's in miami beach
1, Hot pink cupcakes for Lillie's Wedding Shower. First use of baking in white candy cups.
6, 18th Birthday cake tower, pink cupcakes topped with flowers on a Classikool cake stand. Cakes by Clare Chapman
1, Lemon Meringue cupcakes baked in white foil baking cups wrapped with bird theme cupcake wrappers.
6, obama cupcakes by flying monkey
1, bear cupcakes in box
7, Left:Jidori chicken confit, Right:octopus salad :Cabbage soup in a cup : Sauted vegatable in back
1, Made in planet cake cupcakes book lauch, Had lots of fun!
7, Urban Coffee Series - Thursday Dutch fish soup in espresso cup
7, fish soup in ancient crock pot
1, Happy visitor to the icecream van baths in flavour cloud
0, This is a toasted rice ball in a green tea soup with crackers and green onions and nori strips. Very satisfying!
3, fishhead soup (mystery fish) at the market adjoining yehliu geo-park, northern coast of taiwan.  Eyeball in the sticks.
1, Japanese Ochazuke soup: sencha green tea to be poured over brown rice, baked salmon, &amp;amp; wasabi.Chicken sausage, naan &amp;amp; raita
1, Food preparation area - see the plate of chicken and liver - that's what I had in my soup!
2, Vanilla cake with colored layers in white, orange and yellow topped with SMBCHalloween cupcake order for 5 doz cupcakes
4, 300 mini cupcakes and cutting cake in navy, lime green and white.
1, Boston creme cupcakes in a pizza box
7, noodle soup in white plate over the black background
1, Getting ready to make flower pot cupcakes here are the toppers ready to go sugar cookies decorated in RI .
1, pink rose cupcakes in a pot
1, christmas 2009 in the kitchen while we were making cupcakes with her new girl gourmet cupcake maker
4, cupcakes -- in black and white
7, Mee Calong = noodles in clear soup with fish balls, tofu and beansprouts = yums!
1, winter garden in a rolling pink handmade box nourished by astronaut icecream style pellets
1, Two cute fondant frogs in a pond sit atop this couples cake with some lovely cupcakes to match!
1, Getting ready to make flower pot cupcakes here are the toppers ready to go sugar cookies decorated in RI
0, instead of getting her soup in a bowl like &amp;quot;normal&amp;quot;, the italian restaurant gave missy her soup in a box
0, instead of getting her soup in a bowl like &amp;quot;normal&amp;quot;, the italian restaurant gave missy her soup in a box
4, Chips and dip from Rose, vegetables from Jennifer, fresh fruit salad from Marianne and red velvet cupcakes make from scratch by Kara's mom.
1, A Taste of Rubies Edible Favors - Red velvet cupcakes in little cute house boxes
1, punk rock kitchen (necessary ingredient in vegan cupcakes)
3, The view out the door whilst eating icecream at Fanny's on the last day in Hanoi.
1, Raspberry &amp;amp; white chocolate mini cupcakes - customer wanted simple design in pink &amp;amp; green for girl's 2nd birthday
9, weekend specials: vegetarian Italian wedding soup, Viet salad, burritos, rice ball in Matcha green tea broth..
4, Teriyaki chicken over brown rice, salad, gyoza, California roll and miso soup. At Itsuki.
1, Pretty in pink & silver cake & cupcakes for a combined 20th & 21st birthday
7, the floor outside &amp;quot;St. John of God&amp;quot;'s soup kitchen in Abadiania
2, Small white cake with baby in flower topper. cupcakes iced with bc with fondant accents
1, Hi hat cupcakes - red velvet cupcake with green italian meringue dipped in semi-sweet chocolate.Halloween cupcake order for 5 doz cupcakes
1, Hi hat cupcakes - red velvet cupcake with green italian meringue dipped in semi-sweet chocolate.Halloween cupcake order for 5 doz cupcakes
7, fish cake in soup
3, I know it looks like pea soup green but it matches the yellow in the Kitchen very well.
7, ubiquitous greens, fish buried in nuts, scalding duck soup
1, Made in planet cake cupcakes book lauch, Had lots of fun!
1, The chicken broccoli black bean soup, at the Broadway Grill, in Seattle's Capitol Hill neighborhood.
1, Choclate cupcakes hearts, daisies, butterflies in red & pink
7, wonderful chicken soup in Stock pot
3, butterfly at the base of a tree trunk in the garden landscape cupcakes
3, Left: black truffle explosion. Right: the hot potato-cold potato soup without the soup poured in the bowl yet.
3, Left: black truffle explosion. Right: the hot potato-cold potato soup without the soup poured in the bowl yet.
0, Made at home in a D.O. and moved to a crock pot for the office crowd (soup day).Ingredients:BaconOnionGarlicPepperCeleryChicken BrothHam HocksBeans
1, Lunch on our boat cruise in China.  The shrimp was my favorite but beware of the fish soup...
3, Dinner made by one of Kate's friends...yes, that is an entire chicken in the bowl of soup
7, The duck was swimming around at Titchwell in a golden muddy soup.
4, lunchtime! Left over chicken noodle soup, wheat fiber crackers and light laughing cow cheese.
7, Cuban black bean soup in bread bowl
6, sugar free black raspberry and dark chocolate icecream bar by Blue Bunny. they're good. but they've got rules.
1, Birthday girl got a special box of Barbie themed cupcakes in her favourite colour pink.
3, A monkey getting the cold icecream treatment, in the shopping street leading to USJ.
7, clear seafood soup in fish dumpling
7, Scallop in pea soup with flying fish roe
7, mixed fish ball soup.  I think there was shark meat in there.
7, hearty chicken soup in a large pot with lid
8, Thai rice noodle soup serve with slice chicken simmer in the soup and top with bean sprouts, green onion and fry garlic.
8, Thai rice noodle soup serve with slice chicken simmer in the soup and top with bean sprouts, green onion and fry garlic.
7, yes, she is sitting in a soup pot
3, beginning stages of a corn soup - corn and onions saute-ing in the soup pot before the chicken stock goes in
3, beginning stages of a corn soup - corn and onions saute-ing in the soup pot before the chicken stock goes in
1, Getting some hand-dipped icecream on the way up to my lake house over Memorial Day weekend.
3, I made these cupcakes for a Halloween party  last year. Love the orange and black sprinkles against the green icing!
7, cuppa soup in a plastic bowl -  sustainance of kings! Richard staring mournfully at reconstituted carrot.
6, Testing my camera-phone-to-flickr on a bowl of instant udon soup. Soup by Annie Chun (instant add water and mix!)
7, Grouper ball rice noodle in fish soup
8, The flavor is &amp;quot;Oshiruko&amp;quot;, a sweet red bean soup with a rice cake floating in the middle.
1, Extremely zesty orange and poppyseed cupcakes that leaves your tongue tingling.Made with oranges from tree in the backyard.
1, yep, i made these. cupcakes in a pink box + cute wooden cut outs = pretty!
3, page 2 of a paper about cupcakes i accidentally grabbed in the library about cupcakes...or the death penalty
3, page 2 of a paper about cupcakes i accidentally grabbed in the library about cupcakes...or the death penalty
7, chicken noodle soup and carrots in pot
7, Spicy pig blood soup at night market in Taipei, Taiwan
4, A warm basket of brown and white ryes. Mmm. We ate them with butter and dipped in our soup.
7, Noodles in soup with chicken and green lettuce.
6, The cake surrounded by cupcakes and a high heel shoe cake cutter.
0, a lamp focused in a bowl of very spicy soup.
7, turtle fish soup on river cruise in guilin
1, Large cupcakes in clear plastic box...the box is so sweet, love this too :)
7, thick mushroom soup in the black bread bowl
6, A Spongebob white cake surrounded by 10 cupcakes showinf some of the characters from the show
3, chicken breasts baked in marinade; the stock bubbles away on one burner, and the soup base gurgles on the other
1, in case you were wondering how much cake flour you need for 200 red velvet cupcakes
7, Keep in mind that for scale, that coffee cup is one of those extra huge soup bowl sized mugs...
3, ....part of the red bridge accross the pond around the Richmond Speedskating Oval...happy joyous Sunday!...off to make cupcakes at Crumsby's!!
7, Day 3's lunch: Yang chuen noodle in cilantro soup (+ bok choy + fish ball + Chinese dumplings) by ME!
1, Mini cupcakes with flower design. Suitable for hantaran/gift - in clear box with organza ribbon.Pls email aimishaz@yahoo.com for inquiries! :)
1, Mini cupcakes in clear box again
4, Let's Eat Together, Yau Ma Tei, Kowloon, Hong KongWide, fettucine-like pumpkin noodles with chicken and black mushrooms in soup.
3, If you boil the water you end up with a nice turtle soup in the Curacao Zoo.30.07.2005
1, tire cupcakes in the window box
4, Classic yellow cake cupcakes with  pink and brown sparkles, sprinkles, dots and swirls. for the girly-girl in all of us!
2, Cupcake tower with 55 regular sized vanilla cupcakes in black cases.Decorated with vanilla buttercream, and topped alternating silver and black stars and &amp;quot;21&amp;quot;.
7, Cup of soup on glass plate at event in Sydney.
6, my god-daughters birthday cake - she wanted a giant cupcake surround by little cupcakes all pink and sparkly
0, mini chocolate cake surrounded by cupcakes, perched in a puddle of ganache.  Kinda resembles a bear paw.
1, Made in planet cake cupcakes book lauch, Had lots of fun!
7, A girl eating hot soup while a boy skates in Jubilee Gardens.
7, View from my kitchen window.  The large soup pot is drying in the foreground--I made pasta in it yesterday.
7, first time in life i tried the 100% genuine saito fish ball soup from Alward, hand-made in progress...ho cheak !
1, Made in planet cake cupcakes book lauch, Had lots of fun!
1, dog cupcakes made by our friends Bill and Marissa - for human consumption, just in the shape of furry friends
4, Mesquite chicken with potato chunks and broccolli &amp;amp; veggies under salsa, and side cup of chicken soup.
7, Lone fish cake roll in clear soup
6, Mossy's Masterpiece - Matching shoe & bag cupcake box - Karratha cakes & cupcakes made locally by Mossy
6, The beautiful princess' castle cake made by Nana and Gramma complete with princess cupcakes
6, different animal cupcakes along with the humpty dumpty cake by armi &amp;amp; roselle! banana choc chip cupcakes with butter icing.
6, different animal cupcakes along with the humpty dumpty cake by armi &amp;amp; roselle! banana choc chip cupcakes with butter icing.
7, I don't know if it has sonar , otherwise how does it find fish in the green soup
4, Classic yellow cake cupcakes with  pink and brown sparkles, sprinkles, dots and swirls. for the girly-girl in all of us!
7, The first homemade dish eaten after my arrival in Texas, along with a big bowl of matzoh ball soup
3, I loved that chicken and coconut soup and the way they decorate the plates with hand cut vegetables in flower shapes!
3, Course 6: Octupus with dill on the fork, green garbanzo and garlic soup with mint foam in the bowl
1, Brownies cupcakes with white n blue buttercream, decorated with roses n butterflies...supposedly for a wedding in Feb.
7, beef ball &amp;amp; fish ball noodle in soup (garden cafe in alhambra)
4, Wedding dress mini cake design and coordinating cupcakes in wedding party colors.
8, Cooking bean with bacon soup on the stove in my red dutch oven.
1, My elder boy turned five.  And insisted we frost the cupcakes in orange and green.
4, chicken and orzo soup, artisan break and beach bum colada cupcake with AWESOME lime curd in the middle!
0, This lobster soup was served in a piece of stiff white paper in a fancy bowl. There's a lobster tail under that lobster head.
6, Mossy's Masterpiece - Awhina's super girl cake & cupcakes - Karratha cakes & cupcakes made locally by Mossy
6, Mossy's Masterpiece - Awhina's super girl cake & cupcakes - Karratha cakes & cupcakes made locally by Mossy
4, White fish cake (with seaweed and edamame and carrots), in a mushroom and chrysanthenum soup, topped with citrus pepper paste
4, cupcakes for boys and girls in blue and pink
6, We had chicken soup, barbecue, marinara pasta made by mom! And lola's cake and ice cream from lolita. Yummy!
0, cupcakes in a vase, cupcakes decorated like roses to look like a bouquet of flower
0, cupcakes in a vase, cupcakes decorated like roses to look like a bouquet of flower
0, ...use a real free land chicken in a &amp;quot;Meissen Blue Onion&amp;quot; soup plate on a white tablecloth.
2, Vanilla cake with colored layers in white, orange and yellow topped with SMBCHalloween cupcake order for 5 doz cupcakes
3, and celery in the blue bag - the offcuts went into the soup yesterday
7, Pretty typical cream soup at some strange Haitian-themed restaurant in an office building in the Shiodome area.
7, soup in black & white
3, no, not a fly in my soup, just a tree in the road. this tree is the one covering the red truck.
7, Fish head in my soup with VERY white eye ball that kept falling out.
3, Digging into the birthday cake (cupcakes in ice cream cones).Notice the great backyardigans coloring book from Tony
0, This goes in a big bowl of chicken soup.
7, I shook the liquid soup bottle that was in my bathroom and that is what it looked like.
0, Bought a bunch for making soup - had a bit left standing in a little pot of water.............
1, 12 cupcakes in the shape of a flower with pink butterflys complete this flower cupcake birthday cake
3, These are the people who helped with the Saturday barbecue at the soup kitchen at the Holy Cross formation house in Santiago.
4, Chocolate Christmas tree cupcakes with a peppermint cream star covered in gold and red glitter.
9, weekend specials: vegetarian Italian wedding soup, Viet salad, burritos, rice ball in Matcha green tea broth..
6, sugar free black raspberry and dark chocolate icecream bar by Blue Bunny. they're good. but they've got rules.
7, Tomato soup in my green bowl
9, weekend specials: vegetarian Italian wedding soup, Viet salad, burritos, rice ball in Matcha green tea broth..
6, Tiny cupcakes made by my fantastic husband...  white cake with whipped strawberry icing.
3, this girl was in the battle with the chicken noodle soup dance
6, Inspired by Anne @ the pink cake box!Order for a high school graduate, +36 cupcakes and 24 cookies
8, kimchi, nasty version of &amp;quot;spaghetti&amp;quot; ..good soft squid mixed in red hot sauce, chicken and other things soup, rice
1, cupcakes charmingly presented in a cardboard fruit packing box :0)
1, pretty flower cupcakes above the seasame street ones
1, Green tea icecream and mixed fruit bowl at the pan-asian restaurant in Ankara
7, This fish soup had beef and chicken in it! It was very nice, though. 14/06/2006
7, for our first breakfast in Saigon we had duck noodle soup from a street vendor... DE-licious!
1, baby in the bath tub baby shower cupcakes
7, Orange soup in blue soup bowl
7, Orange soup in blue soup bowl
1, orange flower water cupcakes with cardamom - viewed from above
4, Classic yellow cake cupcakes with  pink and brown sparkles, sprinkles, dots and swirls. for the girly-girl in all of us!
4, Sauteed veggies in fillo dough, fruit salad, green salad with bibb lettuce. Oh: and black bean soup.
2, Vanilla cupcakes baked in silver foil cases and topped with pale green fondant icing, finished with flower daisies.
4, Raspberry white choc and white choc mud cupcakes with silver cachous, and fresh flower topper (provided by bride)
0, We had a little farewell party with a cake and cupcakes for one of my colleagues in the office today.
2, Simple vanilla cupcakes with vanilla buttercream and pink mimosas, presented in butterfly baskets
2, Chocolate mudcake and orange cake covered in fondant icing with matching vanilla cupcakes.
7, Clam, seafood and chicken soup in a tea pot with sea food stock to drink in the tea cup!
7, I have a cold today. This is my reflection in the pot while I'm heating up some chicken soup.
6, home cooked meal by adrians sister...fish soup, dagalos, rice, duck and grilled fish
1, Lemon Meringue cupcakes baked in white foil baking cups wrapped with bird theme cupcake wrappers.
7, Provencal fish soup in the fish like bowl
6, only when made by an pole you can call it chicken soup
3, Part of the pooh bear cupcake towerCupcakes have been inspired by the gorgeous Kylie Lambert beauiful garden and butterfly cupcakes.
1, These cupcakes accompanied a road sign birthday cake and were made for my older sons' fifth birthday in February 2009.
7, Die cast car lledo made in england Campbell's soup truck 1997
1, These cute cupcakes with the fireman hat picks were in 4 flavors Strawberry, Lemon, Chocolate, and Funfetti.
2, Cupcake tower with 55 regular sized vanilla cupcakes in black cases.Decorated with vanilla buttercream, and topped alternating silver and black stars and &amp;quot;21&amp;quot;.
3, A bowl of miso soup full of udon noodles and tofu, with a glass mug of green tea in the background.
1, These colorful candies are made out of fish and melt in your soup!
6, topsy turvy cake inspired by book by lindy smith. + cupcakes inspired by gingerbread house
1, i recommend buyng the icecream in a plastic cup before boarding
1, Extremely zesty orange and poppyseed cupcakes that leaves your tongue tingling.Made with oranges from tree in the backyard.
1, 8 in beach cake plus cupcakes
3, page 1 of a paper about cupcakes i accidentally grabbed in the library about cupcakes...or the death penalty
3, page 1 of a paper about cupcakes i accidentally grabbed in the library about cupcakes...or the death penalty
3, JJ's homemade potato soup!  It was in the crock pot all day and made the house smell wonderful!
1, Granddad in back, our older son - father, birthday girl and brother eating pizza before cupcakes
7, Fish ball and minced pork in large bowl of soup
7, soup in a dog bowl
1, Mini cupcakes in clear box
1, cat in the hat dr seuss cupcakes
4, Rice and red beans in the banana leaf and soup with 'high fiber fruits, vegetables and yellow vine'
1, Neat stained glass window in the Steak &amp;amp; Ale in Birmingham.  They have wonderful French onion soup.
3, Dragan, Roger, Gaynor had fresh chicken soup at the the market in downtown Cuzco. Highly recommended!
1, Hi hat cupcakes - red velvet cupcake with green italian meringue dipped in semi-sweet chocolate.Halloween cupcake order for 5 doz cupcakes
1, Hi hat cupcakes - red velvet cupcake with green italian meringue dipped in semi-sweet chocolate.Halloween cupcake order for 5 doz cupcakes
6, Lavender infused cupcakes. Lit by the setting sunlight, diffused by a thin white curtain, through my kitchen window.
7, Catching up again.Cooking in summady's kitchen in Melbourne.  It was a cross between beef stew and tomatoe soup. lol
1, An illustration I did with boys in fancy dress standing on top of cupcakes
1,  penguins in icecream bowl ice cream composing penguin fantasy imagination cold sky
1, christmas 2009 in the kitchen while we were making cupcakes with her new girl gourmet cupcake maker
1, Brownies cupcakes with white n blue buttercream, decorated with roses n butterflies...supposedly for a wedding in Feb.
7, a set of chicken rice cooked by me. The soup - plenty of white cabbage, fish balls, and button mushrooms.
1, A girl in sailor striped mini dress with her friend has bought an icecream
1, cat in the hat cupcakes
1, reflection in icecream van mirror of St Peter's Basilica
0, Made at home in a D.O. and moved to a crock pot for the office crowd (soup day).Ingredients:BaconOnionGarlicPepperCeleryChicken BrothHam HocksBeans
8, Chicken over rice &amp;amp; fish ball soup
7, fish in the middle of rice deep fried ball thing in soup
3, I made these cupcakes for a Halloween party  last year. Love the orange and black sprinkles against the green icing!
7, tientsin cabbage braised in a superior soup with crab roe and white flower crab meat
4,  blue and brown wedding shower cupcakes, with handmade gumpaste flowers and leaves, in luscious lemon, brown butter pecan and pumpkin
3, sautee the seaweed with garlic and crumble in ground beef, as the base for soup.
2, Mini cupcakes topped with marshmallow fondant swirl Christmas trees in pink and white
4, simple cupcakes with pink, black and white decoration, in lace paper wrappersEvent: Lauryn's 4th Birthday!
7, Ramen in Kuro soup base topped with beansprouts, fish cake, green onions, and kimchi.
8, chicken with carrots, onions, red peppers, and garlic left over from starting a vegetable soup.
0, A toy boat in a bowl of noodle soup blowing smoke. The view from a porthole.
3, The vegetarian soup is in the green pot, because it's green.  Therefore, in the silver pot is meaty soup, because it's silver.
3, The vegetarian soup is in the green pot, because it's green.  Therefore, in the silver pot is meaty soup, because it's silver.
1, 20 cupcakes covered in white buttercream icing make up this cupcake cake decorated like a baseball
7, My first proper meal in Singapore, fish ball soup with sugar cane juice at a local hawker centre!
7, Camp chef specializing in oatmeal, everything but the kitchen sink soup and garbage bag salad!
7, Big bowl deal; of fish, onion, mushroom and black pepper in egg noodles in soup at the Coventry Noodle Bar
3, the la sal mountains off in the distance, in the fore ground are &amp;quot;soup bowls&amp;quot; in sand stone with lichen of various color
0, Boiled shredded chicken in a white gravy with dumpling. Like a more hearty chicken noodle soup.
4, Hearty pieces of minced fish and pork stuffed into eggplant, red chilli, fried tofu and bittergourd simmered in chicken soup.
4, Vanilla cake with rich chocolate truffle frosted cupcakes and a white chocolate cameo dusted in pearl - romaaaaaaance, darling!
1, Pretty pink flower cupcakes in full glittery bloom!
8, Curry NoodlesChinese egg noodles + rice noodles in curry soup base with vegetables, cuttlefish, pig's blood cake
1, cat in the hat cupcakes 2
7, Perhaps the most delicious fish ball soup you can find in all of Taiwan.
3, The fish in the soup you see was alive about one minute before he reached the table
1, making crayon cupcakes: de-labeled broken crayons in green bowl
7, I had my chicken soup in that bowl first, so it's looking a little greasy....
3, The classiest wedding cake ever.Note that there are only white cupcakes present, the colored ones were segregated in the kitchen.
7, flying object over the soup table
3, Close-up.A bit strange how the water from the soup gets suched up in the rice leaving the green borccoli stuff unevenly distributed.
7, The market house in annapolis, eating some soup while sketching with emily. Down town annapolis is full of life.
7, noodle soup in white plate over the black background
7, fish ball noodle soup.  dish we often ad in singapore
3, This is the bowl of soup Angeline found a chicken foot in while in Ecuador.  Maybe talon is the correct term
7, Gale and I having hot ,home made chicken soup on a side street in Charlevoix
4, chocolate mud cupcakes iced with red and black fondant in an attempt to look like a ladybird/lady bug.
2, wedding cupcakes vanilla sponge in silver foil cases with white vanilla frosting, butterflies, glitter and silver dagrees
7, tom yam fish soup cooked in pot
7, Bird eating tomato soup in the kitchen with Sylvia
0, Jeremy next to a cave. The small icecream box in the middle has a guest book you can sign!
1, Final ingredients for the soup: cooked chicken breast, cilantro, lime zest, cornmeal dissolved in water
3, During the show at the soup kitchen - Tony in the blue hat
1, My granddaughter Charlotte '4' eating a much enjoyed '99' icecream at the beach in Seapalling, Norfolk
0, Simple yellow cake with buttercream cupcakes for a dear friend in a nursing home.
1, A cup full of yellow split peas and red lentils, all ready to go in the soup!
0, soup near a dog on a box
2, inspired by pink cake boxchocolate cake with buttercream, covered in fondant.  Southern yellow cupcakes, chocolate cupcakes iced in vanilla buttercream
2, inspired by pink cake boxchocolate cake with buttercream, covered in fondant.  Southern yellow cupcakes, chocolate cupcakes iced in vanilla buttercream
1, Groom's cake table...3 dozen mini cupcakes in butter white with coordinating colors for the celebration.
7, facts no #443:Don't you know its hard to eat a soup in the sub ocean floor
6, Small white cake with bc and fondant accents. Accompanied by decorated cupcakes
4, An easy chicken and corn soup, with just under five ingredients, including water
0, The cake was a bunch of cupcakes in the shape of a butterfly - I forgot to take a picture of it.
8, last breakfast in Pundakit: fish soup, itlog [eggs], + fried white rice
2, Chocolate mudcake butterfly cake covered in Fondant icing with 100 vanilla cupcakes (75 displayed and 25 in the kitchen)
1, christmas 2009 in the kitchen while we were making cupcakes with her new girl gourmet cupcake maker
1, The car dealership brought in the icecream truck so everybody could have desert
3, the clear liquid in the bowl is soup made from boiled yak bones, and the pink stuff is &amp;quot;carrots&amp;quot;
1, Hi hat cupcakes - red velvet cupcake with green italian meringue dipped in semi-sweet chocolate.Halloween cupcake order for 5 doz cupcakes
1, Hi hat cupcakes - red velvet cupcake with green italian meringue dipped in semi-sweet chocolate.Halloween cupcake order for 5 doz cupcakes
1, Lemon Meringue cupcakes baked in white foil baking cups wrapped with bird theme cupcake wrappers.
0, sneaking a peek at my dinner tonight noodles, garlic chicken + kastanje mushrooms in a spicy coconut soup base :)
7, wang bu liu xing /  creeping figuse fruit as tonic in soup with green papaya to produce breast milk
4, White fish cake (with seaweed and edamame and carrots), in a mushroom and chrysanthenum soup, topped with citrus pepper paste
7, bear bathing in a green soup
