6, Angela stopped by to bring me some homemade chicken noodle soup and brought her new puppy to visit as well.
5, 5 cupcakes and two bottles of juice later he flipped the coffee table and punched a hole in the wall.
1, Ellen (wearing glasses in the back) and Steve (concentrating on his matzo ball soup)
4, For Ben. The roll is beheaded cupcakes stuffed with sour straw candy, and wrapped in green apple fruit rollups...
8, Glutinous rice balls stuffed with black sesame paste in preserved petals of sweet osmanthus and fermented glutinous rice soup
7, USA, silver plated soup spoon with round bowl and  logo in raised lettering on front, 15,5cm
7, Double bowl is great, I got to try spicy noodles in soup &amp;amp; black bean noodles!Both were yummy!
7, Rice ball with salmon in soup
0, The soup kitchen has evolved from a small wooden expansion to a solid kitchen, in a lovely pink color.
7, We had homemade chicken noodle soup over mashed potatoes and apple crisp for dessert.
7, A shot of spicy chicken soup in the hotel bar at happy hour
4, Colourful cupcakes in clear resin and encapsulated in a sterling silver dome. Domes and chain are sterling silver.
4, Chocolate cupcakes filled with chocolate Bavarian cream. Leaves are white chocolate painted over apple and roses leaves bow and flowers are fondant.
7, Phenomenal soup!! Boiled in a paper bowl with charcoal underneath.
4, Chocolate cupcakes for a 2-year old's birthday.  All the butterflies and flowers were in bright orange, pink, and yellow.
1, Fried green tomatoes, she crab soup, shrimp corn dogs etc from @amenstreet in Charleston
5, 5 cupcakes and two bottles of juice later he flipped the coffee table and punched a hole in the wall.
7, lunch, apples in that chicken soup!!
1, I made cupcakes and white chocolate dipped fruit as well as i dipped them in the themed color sugars
5, 5 cupcakes and two bottles of juice later he flipped the coffee table and punched a hole in the wall.
7, pumpkin soup in a blue pot
3, We put some chunks of chicken in this bowl of duck soup. Kirby finishes the bowl and munches on some chicken.
5, 5 cupcakes and two bottles of juice later he flipped the coffee table and punched a hole in the wall.
3, tofu soup.  the red one is made by the blood of ducks
1, Espresso flavored cupcakes in paper coffee cups with cinnamon vanilla icing.
7, M swimming in some fish soup
4, A three layered choc mud cake wiith choc ganache, and layers of mocha and lemon raspberry mini cupcakes in matching foils.
2, These were very last minute cupcakes.  Butter cake with sour cream and white chocolate, with vanilla bc covered in fondant.
7, miso soup bowl in red lacquer
2, Just playing around with colors! Vanilla cupcakes topped with blue and yellow vanilla buttercream rose swirls.
7, sitting in the shade having my tomato soup watching people pick up their bags
4, A Magenta tower with handmade roses and mini rose budsA Vanilla cutting cake and cupcakes in Chocolate, Toffee, Gingerbread flavours
1, happy birthday candles in front of bryan's cake and cupcakes
7, Flower H'mong tribeswomen eating noodles in soup at market
5, 5 cupcakes and two bottles of juice later he flipped the coffee table and punched a hole in the wall.
7, Stopped in at Canter's for a fine bowl of matzo ball soup for dinner.  Yum!
1, lemon yellow raspberry cupcakes under glass
0, a dozen red velvet cupcakes &amp;amp; a dozen red roses b/c he will be in NY during valentine's day...
1, these balls cooked  in the hot pot (steaming soup) ,very delicious~
1, Dr.Seuss fish in the bowl cupcakes cake!
7, melon balls with matching sorbets in a honeysuckle flower soup
1, Red velvet cupcakes adorned with red roses in a martini glass. Love at first sight
5, After 5 cupcakes and two bottles of juice later he flipped the coffee table and punched a hole in the wall.
6, Mini flowered cupcakes in pink and green by Soignee.
2, Vanilla cake covered in fondant icing with gumpaste roses and vanilla cupcakes with buttercream icing.
6, jars of customised Sticky rock candy &amp;amp; boxes of mini cupcakes by Selendang Sutera, decorated by Mimpi Murni
7, for soup in a plastic cup and fries
2, Wedding cupcakes in vanilla sponge with gluten-free fruit cake on top tier. Decorated with sugarpaste gerberas. July 08.
2, Vanilla sponge cupcakes decorated with fondant icing and fondant roses in bridal white and soft pink.
7, Noodles soup in plastic bags
7, PJ's chicken noodle soup in bread bowl
4, Made 120 mini cupcakes in yellow and orange.  Got to use my new boxes and carriers :).
1, Chicken wonton soup.  Thin skin wonton, veggies, served in home made chicken stock.
7, Tomato soup in a brown bowl
7, Dried flowers for soup in Guard house at Lake Nyos
1, Baklava and lemon marshmallow cupcakes in the world's flimsiest cake box.
3, Also designed with dinner plate, mug and soup plate in this collection. This is one of the design in this year.
7, Deep fried tofu, eggplant and chicken balls in fish stock soup
7, beef balls in glass (rice flour) noodles soup
7, chicken noodle soup with home made noodles, visiting auntie in the countryside
1, mountain goat licking icecream in nothern cascades parking lot
1, The amount of food currently in my office is obscene. Yesterday, we had two boxes of cupcakes from Sprinkles!
5, 5 cupcakes and two bottles of juice later he flipped the coffee table and punched a hole in the wall.
1, we had icecream served to us in hollowed out fruit, oranges and lemons mosly...
6, homemade hello kitty cake and cupcakes by olga
7, taufu, brinjals, lady fingers, bitter gourd stuffed with fish stuffing; and fish balls in soup
2, Giant cupcake with silver hearts. Small cupcakes with wafer roses and silver hearts in butter cream.
4, Chocolate cupcakes for a 2-year old's birthday.  All the butterflies and flowers were in bright orange, pink, and yellow.
1, Fried green tomatoes, she crab soup, shrimp corn dogs etc from @amenstreet in Charleston
7, soup pots on food street in Wuhan
6, pok pok chicken wings and thai (tom yum) soup with some grilled/sauteed veggies. homemade by a cute guy!
1, Chocolate cupcakes in silver cups with purple buttercream.
6, day 256under the candles - icecream roll cake - homemade by Scot. mmmmm
2, These were very last minute cupcakes.  Butter cake with sour cream and white chocolate, with vanilla bc covered in fondant.
3, blueberry cupcake at the dar back with lemon cupcakes in the front - all decorated with hand crafted flowers and butterflies.
8, grilled salmon flake rice dumping served with a clear dashi broth - rice in soup
8, Glutinous rice balls in black sesame soup
1, White balls are made of fish mousse and there were also little pork dumplings in the soup.
7, My daughter loves to cook up a feast in the sandpit - fish soup and fish balls today!
5, 5 cupcakes and two bottles of juice later, he flipped the coffee table and punched a hole in the wall.
1, Beach cupcakes - graham bears decorated with royal icing swim suits and sunglasses.  Bear buried in the sand
7, fish balls & sliced fish in soup
6, Tiny cupcakes and paper flowers made by Grace. I purchased them from her Etsy shop. So cute!
1, Blueberry cupcakes with fondant flowers in the green and gold of Australia for an emmigrating friend
1, Very pretty strawberry cakes covered in fondant with raspberry cheesecake cupcakes in the box too.
7, better than any boy in moncora. coconut fish veggie soup properly named: coco loco soupa with fresh calamari. ahh.
4, 7 dozen red velvet mini cupcakes with marshmallow fondant gerbera toppers in red, orange, yellow turquoise, and lime green.
7, eating traditional Akha chicken soup cooked in bamboo!
0, Hanging out in a shop doorway enjoying a mixed berry yoghurt icecream in a bamboo cup with a wooden spoon.
6, Cream cupcakes, topped by lemon & cream cheese and gummy bears
1, plate before soup, duck confit in strudel dough, quail egg
